Goal Number,Goal Name,Current Status,Quantitative Prediction,Qualitative Prediction
One,Increase US Manufacturing,Stable,NA,NA
Two,Increase Burden Sharing of Global Public Goods,Positive,NA,NA
Three,Global Adherence to Revised Trading System,Negative,NA,NA
Four,Avoid Domestic Economic Turmoil,Stable,NA,NA
Five,Maintain Global Dollar Supremacy,NA,NA,NA
Six,Bring Down the Trade Deficit,Positive,NA,NA
Seven,Bring Down US Debt,Positive,NA,NA
Eight,Replace Income Tax Revenue with Tariff Revenue,Negative,NA,NA
